<?xml version="1.0" encoding="UTF-8"?>
<?xml-stylesheet href="empleados.xslt" type="text/xsl"?>
<empleados xmlns:xsi="http://www.w3.org/2001/XMLSchema-instance" xsi:noNamespaceSchemaLocation="empleados.xsd">
    <empleado>
        <nombre>Juan</nombre>
        <apellido>Pérez</apellido>
        <puesto>Desarrollador</puesto>
    </empleado>
    <empleado>
        <nombre>María</nombre>
        <apellido>Gómez</apellido>
        <puesto>Diseñadora</puesto>
    </empleado>
    <empleado>
        <nombre>Rubén</nombre>
        <apellido>Vallejo</apellido>
        <puesto>Desarrollador</puesto>
    </empleado>
</empleados>